<?xml version="1.0" encoding="UTF-8" ?>
<!DOCTYPE component SYSTEM "../../../../Dataflow/XML/component.dtd">
<component name="ConvertMeshToPointCloud" category="ChangeMesh">
  <overview>
    <authors>
      <author>Jeroen Stinstra</author>
    </authors>
    <summary>
      Convert a field into a PointCloud field.
    </summary>
  </overview>
  <io>
    <inputs lastportdynamic="no">
      <port>
        <name>Field</name>
        <datatype>SCIRun::Field</datatype>
      </port>
    </inputs>
    <outputs>
      <port>
        <name>Field</name>
        <datatype>SCIRun::Field</datatype>
      </port>
    </outputs>
  </io>
</component>

