<?xml version="1.0" encoding="UTF-8"?>
<!DOCTYPE component SYSTEM "../../../../Dataflow/XML/component.dtd">
<component name="MapCurrentDensityOntoField" category="ChangeFieldData" optional="false">
  <overview>
    <authors>
      <author>Jeroen Stinstra</author>
    </authors>
    <summary>
      This module maps potentials and conductivities into a current density field. The module samples the underlying fields and averages or integrates the data and puts the result on the elements of the output mesh. The module has the option to do the dot product with the current density field as well for surface destination meshes.

    </summary>
  </overview>
  <io>
    <inputs lastportdynamic="no">
      <port>
        <name>Potential</name>
        <datatype>SCIRun::Field</datatype>
      </port>
      <port>
        <name>Conductivity</name>
        <datatype>SCIRun::Field</datatype>
      </port>
      <port>
        <name>Destination</name>
        <datatype>SCIRun::Field</datatype>
      </port>
    </inputs>
    <outputs>
      <port>
        <name>Destination</name>
        <datatype>SCIRun::Field</datatype>
      </port>
    </outputs>
  </io>
</component>
