<?xml version="1.0" encoding="UTF-8" ?>
<!DOCTYPE component SYSTEM "../../../../Dataflow/XML/component.dtd">
<?xml-stylesheet href="../../../../Dataflow/XML/component.xsl" type="text/xsl"?>
<?cocoon-process type="xslt"?>

<!--
   For more information, please see: http://software.sci.utah.edu

   The MIT License

   Copyright (c) 2004 Scientific Computing and Imaging Institute,
   University of Utah.

   
   Permission is hereby granted, free of charge, to any person obtaining a
   copy of this software and associated documentation files (the "Software"),
   to deal in the Software without restriction, including without limitation
   the rights to use, copy, modify, merge, publish, distribute, sublicense,
   and/or sell copies of the Software, and to permit persons to whom the
   Software is furnished to do so, subject to the following conditions:

   The above copyright notice and this permission notice shall be included
   in all copies or substantial portions of the Software.

   THE SOFTWARE IS PROVIDED "AS IS", WITHOUT WARRANTY OF ANY KIND, EXPRESS
   OR IMPLIED, INCLUDING BUT NOT LIMITED TO THE WARRANTIES OF MERCHANTABILITY,
   FITNESS FOR A PARTICULAR PURPOSE AND NONINFRINGEMENT. IN NO EVENT SHALL
   THE AUTHORS OR COPYRIGHT HOLDERS BE LIABLE FOR ANY CLAIM, DAMAGES OR OTHER
   LIABILITY, WHETHER IN AN ACTION OF CONTRACT, TORT OR OTHERWISE, ARISING
   FROM, OUT OF OR IN CONNECTION WITH THE SOFTWARE OR THE USE OR OTHER
   DEALINGS IN THE SOFTWARE.
-->



<component name="ApplyFEMCurrentSource" category="Forward">
  <overview>
    <authors>
      <author>David Weinstein</author>
    </authors>
    <summary>The ApplyFEMCurrentSource module builds the right-hand
side (ColumnMatrix) to reflect monopolar and dipolar current sources
for finite-element based bioelectric field problems.</summary>
  </overview>
  <io>
    <inputs lastportdynamic="no">
      <!-- one of (device port file) -->
      <port>
	<name>Mesh</name>
	<description>
	  <p>Field containing the volume mesh</p>
	</description>
	<datatype>SCIRun::Field</datatype>
	<componentname>FieldReader</componentname>
      </port>
      <port>
	<name>Sources</name>
	<description>
	  <p>Either a PointCloudField&lt;Vector> (for dipoles) or a
PointCloudField&lt;double> for current densities.</p>
	</description>
	<datatype>SCIRun::Field</datatype>
	<componentname>FieldReader</componentname>
      </port>
      <port>
	<name>Mapping</name>
	<description>
	  <p>Maps source nodes indicies to volume mesh nodes
indices.</p>
	</description>
	<datatype>SCIRun::Matrix</datatype>
	<componentname>MatrixReader</componentname>
      </port>
      <port>
	<name>Input RHS</name>
	<description>
	  <p>(Optional) Handle to the matrix containing RHS for FE
discretization obtained from SetupFEMatrix.</p>
	</description>
	<datatype>SCIRun::Matrix</datatype>
	<componentname>SetupFEMatrix</componentname>
	<componentname>MatrixReader</componentname>
      </port>
    </inputs>

    <outputs>
      <!-- one of (device port file) -->
      <port>
	<name>Output RHS</name>
	<description>
	  <p>Sends handle to Matrix containing dipole terms to
downstream modules</p>
	</description>
	<datatype>SCIRun::Matrix</datatype>
	<componentname>SolveMatrix</componentname>
	<componentname>MatrixWriter</componentname>
      </port>
      <port>
        <name>Output Weights</name>
	<datatype>SCIRun::Matrix</datatype>
      </port>
    </outputs>
  </io>
</component>
