<?xml version="1.0" encoding="UTF-8" ?>
<!DOCTYPE component SYSTEM "../../../../Dataflow/XML/component.dtd">
<!--
   For more information, please see: http://software.sci.utah.edu

   The MIT License

   Copyright (c) 2004 Scientific Computing and Imaging Institute,
   University of Utah.

   
   Permission is hereby granted, free of charge, to any person obtaining a
   copy of this software and associated documentation files (the "Software"),
   to deal in the Software without restriction, including without limitation
   the rights to use, copy, modify, merge, publish, distribute, sublicense,
   and/or sell copies of the Software, and to permit persons to whom the
   Software is furnished to do so, subject to the following conditions:

   The above copyright notice and this permission notice shall be included
   in all copies or substantial portions of the Software.

   THE SOFTWARE IS PROVIDED "AS IS", WITHOUT WARRANTY OF ANY KIND, EXPRESS
   OR IMPLIED, INCLUDING BUT NOT LIMITED TO THE WARRANTIES OF MERCHANTABILITY,
   FITNESS FOR A PARTICULAR PURPOSE AND NONINFRINGEMENT. IN NO EVENT SHALL
   THE AUTHORS OR COPYRIGHT HOLDERS BE LIABLE FOR ANY CLAIM, DAMAGES OR OTHER
   LIABILITY, WHETHER IN AN ACTION OF CONTRACT, TORT OR OTHERWISE, ARISING
   FROM, OUT OF OR IN CONNECTION WITH THE SOFTWARE OR THE USE OR OTHER
   DEALINGS IN THE SOFTWARE.
-->



<component name="SimulateDipoleInAnisoSpheresAnalytically" category="Forward">
  <overview>

    <authors>
      <author>Sascha Moehrs</author>
    </authors>

    <summary>
Due to a specified dipole, the potential on the outer sphere of a four
layer spherical volume conductor is computed.
</summary>


  </overview>

  <io>

    <inputs lastportdynamic="no">
      <port>
	<name>Electrodes</name>
	<description>
	  <p>The port takes a handle of the electrode positions where
the potential has to be computed.</p>
	</description>
	<datatype>SCIRun::Field</datatype>
      </port>
      <port>
	<name>Dipole Sources</name>
	<description>
	  <p>The port takes a handle to the matrix that is 1-by-6 in
size, containing parameters of 1 dipole.  The first three columns are
dipole position. The last three colums are dipole moments. If the
dipole lies outside the innermost sphere, the log window creates a
warning message.</p>
	</description> 
	<datatype>SCIRun::Field</datatype>
      </port>

      <port>
	<name>Radii</name>
	<description>
	  <p>The port takes a matrix containing the radii for scalp,
skull, cerebrospinal fluid and the brain.</p>
	</description>
	<datatype>SCIRun::Matrix</datatype>
      </port>

      <port>
	<name>AnisoConductivities</name>
	<description>
	  <p>The port takes a matrix containing radial and tangential
conductivities of all 4 layers.</p>
	</description>
	<datatype>SCIRun::Matrix</datatype>
      </port>
    </inputs>

    <outputs>

      <port>
	<name>ElectrodePotentials</name>
	<description>
	  <p>The initial field is populated with potential values.</p>
	</description>
	<datatype>SCIRun::Field</datatype>
      </port>

    </outputs>

  </io>

  <gui> 
    <description>
    </description>
    <parameter>
      <widget>Text Entry</widget>
      <label></label>
      <description>
      </description>
    </parameter>
    <parameter>
      <widget>Text Entry</widget>
      <label>Expansion Terms</label>
      <description>
      </description>
    </parameter>
  </gui>

  <nets>
    <net id="new.das">
      <title>Dipole In Anisotropic Spheres</title>

      <p>Use of module SimulateDipoleInAnisoSpheresAnalytically is shown in <xref
target="fig.das"/>.  The network computes potentials on the surface of
a sphere.</p>

      <figure id="fig.das">
	<img>../Modules/Forward/doc/sphere.gif</img> 
	<caption>Anisotropic Sphere Model Network</caption>
      </figure>

      <section>
	<title>Inputs</title> 

	<p>SimulateDipoleInAnisoSpheresAnalytically receives sphere model parameters from
module <modref package="BioPSE" name="AnisoSphereModel"/>.  Electrode
positions are recieved, as a field, on the first yellow port. Sphere
radii parameters are recieved, as a matrix, on the first blue port.
Conductivity data are recieved, as a matrix, on the second blue
port.</p> 

	<p>Dipole field data are recieved on the second yellow port
from module <modref package="BioPSE" name="ShowDipoles"/>.</p>

      </section>

      <section>
	<title>Outputs</title>

	<p>SimulateDipoleInAnisoSpheresAnalytically generate  a potential field (electrode
positions and corresponding potential values, which is then
transmitted on its sole output port to modules <modref
package="SCIRun" name="ShowField"/> and <modref package="SCIRun"
name="RescaleColorMap"/>.</p> 

	<p>The potential field and dipole are rendered by module
<modref package="SCIRun" name="Viewer"/> from scene graph data
produced by modules <modref package="SCIRun" name="ShowField"/> and
<modref package="BioPSE" name="ShowDipoles"/>.</p>
      </section>

    </net>
  </nets>
</component>
